{
  "schema_version": "0.1",
  "metadata": {
    "brand_id": "{{BRAND_ID}}",
    "name": "{{BRAND_NAME}}",
    "updated": "{{DATE}}",
    "owner": "UNKNOWN",
    "status": "empty"
  },
  "provenance": {
    "ingested": [],
    "precedence": [
      "user_instruction",
      "approved_brand_state",
      "official_asset",
      "live_brand_behavior",
      "campaign_exception",
      "extracted_pattern",
      "external_reference",
      "model_inference"
    ],
    "gaps": [
      {
        "looked_for": "all brand sections (workspace just created)",
        "where": "run /brand-import for an existing brand or /workflow create-brand for a new one",
        "status": "needs_owner"
      }
    ]
  },
  "sections": {
    "business_truth": {},
    "customer_audience": {},
    "category": {},
    "strategy": {},
    "positioning": {},
    "jobs_to_be_done": {},
    "brand_beliefs": {},
    "brand_tensions": {},
    "value_proposition": {},
    "claims": {},
    "proof": {},
    "voice": {},
    "vocabulary": {},
    "banned_language": {},
    "naming": {},
    "logo_marks": {},
    "color": {},
    "materials": {},
    "textures": {},
    "typography": {},
    "type_hierarchy": {},
    "grid": {},
    "spacing": {},
    "layout": {},
    "components": {},
    "interaction": {},
    "motion": {},
    "sound": {},
    "photography": {},
    "camera_language": {},
    "lighting": {},
    "casting": {},
    "wardrobe": {},
    "locations": {},
    "props": {},
    "product_representation": {},
    "packaging_rules": {},
    "illustration": {},
    "graphic_devices": {},
    "iconography": {},
    "social_behavior": {},
    "cultural_territories": {},
    "reference_mechanisms": {},
    "anti_references": {},
    "asset_registry": {},
    "campaign_history": {},
    "performance_evidence": {},
    "compliance_constraints": {},
    "approved_exceptions": {},
    "known_uncertainties": {}
  },
  "conflicts": [],
  "entities_ref": "brand/brand-world.json",
  "references_ref": "references/"
}
